{
    "general": {
        "name": "A simple parameter set for model testing",
        "creator": "Martyn",
        "timeStep": 86400,
        "internalTimeStepMultiplier": 1.0,
        "startDate": "2020-01-01 00:00:00",
        "model": {
            "repository": "https://github.com/INCAWQModels/Rewrite",
            "branch": "main",
            "commit": "6a80d0f"
        },
        "chemistry": {}
    },
    "bucket": {
        "general": {
            "name": ["Direct", "SoilWater", "Groundwater"],
            "abbreviation": ["DR", "SW", "GW"]
        }
    },
    "landCover": {
        "general": {
            "name":                 ["Forest", "Agriculture"],
            "abbreviation":         ["F", "A"],
            "soilTemperatureModel": {
                "C_s":              [1.1e06,  1.2e06],
                "K_t":              [ 0.61,   0.62],
                "C_ice":            [ 9.1e06, 9.2e06],
                "f_s":              [-3.1,   -3.2]
            },
            "evapotranspirationModel": {
                "temperatureOffset":    [ 1.0,  2.0],
                "scalingFactor":        [11.0, 12.0]
            }
        },   
        "hydrology": {
            "degreeDayMeltFactor":  [ 3.0,  3.2],
            "rainfallMultiplier":   [ 0.91, 0.92],
            "snowfallMultiplier":   [ 1.1,   1.2],
            "snowfallTemperature":  [-0.1,  -0.2],
            "snowmeltTemperature":  [ 0.1,   0.2],
            "snowmeltRate":         [ 1.0,   2.0],
            "snowDepth":            [ 0.0,   0.0],
            "flowMatrix": 
            [
                [   
                    [0.0, 1.0, 0.0],
                    [0.0, 0.1, 0.9],
                    [0.0, 0.0, 1.0]
                ],
                [
                    [0.0, 1.0, 0.0],
                    [0.0, 0.2, 0.8],
                    [0.0, 0.0, 1.0]

                ]
            ]
        },
        "soilOrSediment": {},
        "chemistry": {},     
        "bucket":       [  
                {
                    "general": {
                        "surficial": true,
                        "initialSoilTemperature": 10.0,
                        "relativeAreaIndex":                [1.0, 1.0],
                        "soilTemperatureEffectiveDepth":    [5.0, 5.0]
                    },
                    "hydrology": {
                        "characteristicTimeConstant":       [  1.1,   1.2],
                        "tightlyBoundWaterDepth":           [ 21.0,  22.0],
                        "looselyBoundWaterDepth":           [ 51.0,  52.0],
                        "freelyDrainingWaterDepth":         [101.0, 102.0], 
                        "initialWaterDepth":                [ 21.0,  22.0],
                        "relativeETIndex":                  [  0.0,   0.0],
                        "ETScalingExponent":                [  0.0,   0.0],
                        "infiltrationThresholdTemperature":[  0.0,   0.0]
                    },
                    "soilOrSediment": {},
                    "chemistry": {}
                },
                {
                    "general": {
                        "surficial": false,
                        "initialSoilTemperature": 8.0,
                        "relativeAreaIndex":                [  1.0,   1.0],
                        "soilTemperatureEffectiveDepth":    [ 15.0,  15.0]
                    },
                    "hydrology": {                    
                        "characteristicTimeConstant":       [  8.1,   8.2],
                        "tightlyBoundWaterDepth":           [ 21.0,  22.0],
                        "looselyBoundWaterDepth":           [ 51.0,  52.0],
                        "freelyDrainingWaterDepth":         [101.0, 102.0], 
                        "initialWaterDepth":                [ 21.0,  22.0],
                        "relativeETIndex":                  [  0.5,   0.5],
                        "ETScalingExponent":                [  1.0,   1.0],
                        "infiltrationThresholdTemperature": [  0.0,   0.0]
                    },
                    "soilOrSediment": {},
                    "chemistry": {}
                },
                {
                    "general": {
                        "surficial": false,
                        "initialSoilTemperature": 6.0,
                        "relativeAreaIndex":                [  1.0,   1.0],
                        "soilTemperatureEffectiveDepth":    [ 35.0,  35.0] 
                    },
                    "hydrology": {
                        "characteristicTimeConstant":       [ 15.1,  15.2],
                        "tightlyBoundWaterDepth":           [ 21.0,  22.0],
                        "looselyBoundWaterDepth":           [ 51.0,  52.0],
                        "freelyDrainingWaterDepth":         [101.0, 102.0], 
                        "initialWaterDepth":                [ 21.0,  22.0],
                        "relativeETIndex":                  [  0.5,   0.5],
                        "ETScalingExponent":                [  1.0,   1.0],
                        "infiltrationThresholdTemperature": [  0.0,   0.0]
                    },
                    "soilOrSediment": {},
                    "chemistry": {}
                }
        ]
    },
    "subcatchment": {
        "general": {
            "name":                 ["SC0","SC1"],
            "area":                 [100.0, 200.0],
            "latitudeAtOutflow":    [ 50.1,  50.2],
            "longitudeAtOutflow":   [ 15.1,  15.2],
            "landCoverPercent": [
                [20.0, 80.0],
                [50.0, 50.0]
            ]
        },
        "hydrology": {
            "rainfallMultiplier":   [ 1.1,   1.2 ],
            "snowfallMultiplier":   [ 1.01,  1.02],
            "snowfallTemperature":  [ 0.1,   0.2 ],
            "snowmeltTemperature":  [-0.1,  -0.2]
        },
        "soilOrSediment": {},
        "chemistry": {}
    },
    "reach": {
        "general": {
            "name":                 ["Reach 0", "Reach 1"],
            "length":               [10000.0, 20000.0],
            "widthAtBottom":        [    1.1,     2.2],
            "slope":                [  1e-06,   2e-06],
            "outflow":              [1, null],
            "inflows":              [ [null], [0]]
        },
        "hydrology": {
            "hasAbstraction":       [false, false],
            "hasEffluent":          [false, false],
            "Manning": {
                "a":                [2.71,   2.71],
                "b":                [0.557, 0.557],
                "c":                [0.349, 0.349],
                "f":                [0.341, 0.341],
                "n":                [0.1,   0.1  ]
            },
            "initialFlow":          [1.0, 2.0]
        },
        "soilOrSediment": {},
        "chemistry": {}
    }
}